{"$schema":"https://json-schema.org/draft/2020-12/schema","type":"object","required":["listing_id","lrn_id","lrn_version","governance_state","commercial_state","economic_contract_version","pricing"],"properties":{"listing_id":{"type":"string","pattern":"^LIST-[A-Z0-9-]+$"},"lrn_id":{"type":"string"},"lrn_version":{"type":"string"},"governance_state":{"enum":["proposed","testing","validated","active","suspended","retired"]},"commercial_state":{"enum":["not_listed","listed","commercial","restricted","free","deprecated","unlisted"]},"economic_contract_version":{"type":"string","pattern":"^\\d+\\.\\d+\\.\\d+$"},"pricing":{"type":"object","required":["pricing_model"],"properties":{"pricing_model":{"enum":["free","fixed","usage_based","subscription","enterprise","custom"]},"currency":{"type":"string"},"unit":{"type":"string"},"price":{"type":"number","minimum":0},"effective_from":{"type":"string","format":"date-time"},"effective_until":{"type":"string","format":"date-time"}}},"revenue_distribution":{"type":"object","properties":{"creator":{},"platform":{},"governance":{},"review_pool":{}}}},"allOf":[{"if":{"properties":{"commercial_state":{"const":"commercial"}}},"then":{"properties":{"governance_state":{"enum":["validated","active"]}}}}],"additionalProperties":false}
